{
  "meta": {
    "pack_id": "PACK-ca28ef4e27ff",
    "run_id": "t14_test_demo",
    "created_at": "2026-03-16T15:34:03.128282+00:00",
    "t14_version": "1.0.0-t14",
    "skill_id": "test_skill-1.0.0-abc123",
    "skill_name": "test_skill",
    "pack_context": "exit_gate"
  },
  "pack_type": "STANDARD",
  "artifacts": {
    "discovery": {
      "intake_request": null,
      "normalized_skill_spec": null,
      "validation_report": null,
      "rule_scan_report": null,
      "pattern_detection_report": null,
      "findings_report": "run\\t14_test_demo\\findings.json"
    },
    "adjudication": {
      "adjudication_report": "run\\t14_test_demo\\adjudication_report.json",
      "coverage_statement": null
    },
    "delivery": {
      "judgment_overrides": null,
      "residual_risks": null,
      "release_decision": "run\\t14_test_demo\\release_decision.json",
      "owner_review": null,
      "issue_records": null,
      "fix_recommendations": null
    }
  },
  "evidence_manifest": {
    "total_evidence_refs": 2,
    "by_kind": {
      "FILE": 1,
      "CODE_LOCATION": 1
    },
    "evidence_digest": "b25b1d64a778adaaff07d218c1b7e4d1a6d33c42b216e6223d85dec34711d9ab",
    "findings_with_evidence": 2,
    "findings_without_evidence": 0
  },
  "summary": {
    "total_findings": 1,
    "findings_by_severity": {
      "CRITICAL": 0,
      "HIGH": 0,
      "MEDIUM": 0,
      "LOW": 1,
      "INFO": 0
    },
    "total_decisions": 1,
    "decisions_by_outcome": {
      "PASS": 1,
      "FAIL": 0,
      "WAIVE": 0,
      "DEFER": 0
    },
    "release_outcome": "RELEASE",
    "has_overrides": false,
    "override_count": 0,
    "has_residual_risks": false,
    "residual_risk_count": 0,
    "blocking_findings_count": 0,
    "issues_created": 0,
    "fix_recommendations": 0,
    "coverage_percentage": 0.0
  },
  "compliance": {
    "antigravity_compliant": true,
    "closed_loop_complete": true,
    "evidence_ref_complete": true,
    "governance_gaps_identified": 0,
    "security_findings_count": 1
  },
  "chain_of_custody": [
    {
      "timestamp": "2026-03-16T15:34:03.129785+00:00",
      "event": "PACK_CREATED",
      "actor": "T14-AuditPackBuilder"
    }
  ]
}